{
  "$schema": "http://json-schema.org/draft-07/schema#",
  "title": "CyberRange Scenario",
  "type": "object",
  "required": ["metadata", "networks", "hosts", "flags"],
  "properties": {
    "metadata": {
      "type": "object",
      "required": ["name", "description", "author", "version", "difficulty"],
      "properties": {
        "name": {"type": "string", "minLength": 1, "maxLength": 100},
        "description": {"type": "string", "minLength": 1},
        "author": {"type": "string", "minLength": 1},
        "version": {"type": "string", "pattern": "^\\d+\\.\\d+\\.\\d+$"},
        "difficulty": {"type": "string", "enum": ["easy", "medium", "hard"]},
        "estimated_time_minutes": {"type": "integer", "minimum": 1},
        "tags": {"type": "array", "items": {"type": "string"}},
        "learning_objectives": {"type": "array", "items": {"type": "string"}}
      }
    },
    "networks": {
      "type": "array",
      "minItems": 1,
      "items": {
        "type": "object",
        "required": ["id", "name", "type", "subnet"],
        "properties": {
          "id": {"type": "string", "pattern": "^[a-z][a-z0-9_]*$"},
          "name": {"type": "string"},
          "type": {"type": "string", "enum": ["bridge", "custom_bridge", "isolated", "public"]},
          "subnet": {"type": "string", "pattern": "^\\d{1,3}\\.\\d{1,3}\\.\\d{1,3}\\.\\d{1,3}/\\d{1,2}$"},
          "gateway": {"type": "string"},
          "dns": {"type": "array", "items": {"type": "string"}}
        }
      }
    },
    "hosts": {
      "type": "array",
      "minItems": 1,
      "items": {
        "type": "object",
        "required": ["id", "name", "type", "base_image", "networks"],
        "properties": {
          "id": {"type": "string", "pattern": "^[a-z][a-z0-9_]*$"},
          "name": {"type": "string"},
          "type": {"type": "string", "enum": ["attacker", "victim", "web", "db", "ftp", "smb", "custom"]},
          "base_image": {"type": "string"},
          "networks": {
            "type": "array",
            "minItems": 1,
            "items": {
              "type": "object",
              "required": ["network_id"],
              "properties": {
                "network_id": {"type": "string"},
                "ip_address": {"type": "string", "pattern": "^\\d{1,3}\\.\\d{1,3}\\.\\d{1,3}\\.\\d{1,3}$"}
              }
            }
          },
          "resources": {
            "type": "object",
            "properties": {
              "cpu_limit": {"type": "string", "pattern": "^\\d+(\\.\\d+)?$"},
              "memory_limit": {"type": "string", "pattern": "^\\d+(k|m|g)$"},
              "disk_limit": {"type": "string"}
            }
          },
          "services": {"type": "array", "items": {"type": "string"}},
          "vulnerabilities": {"type": "array", "items": {"type": "string"}},
          "flags": {"type": "array", "items": {"type": "string"}},
          "custom_config": {
            "type": "object",
            "properties": {
              "dockerfile_path": {"type": "string"},
              "build_args": {"type": "object"},
              "environment": {"type": "object"},
              "volumes": {"type": "array", "items": {"type": "string"}},
              "entrypoint": {"type": "string"}
            }
          }
        }
      }
    },
    "services": {
      "type": "array",
      "items": {
        "type": "object",
        "required": ["id", "name", "type", "version", "ports"],
        "properties": {
          "id": {"type": "string", "pattern": "^[a-z][a-z0-9_]*$"},
          "name": {"type": "string"},
          "type": {"type": "string", "enum": ["nginx", "apache", "flask", "node", "mysql", "postgres", "vsftpd", "openssh", "samba", "custom"]},
          "version": {"type": "string"},
          "ports": {
            "type": "array",
            "minItems": 1,
            "items": {
              "type": "object",
              "required": ["internal", "protocol"],
              "properties": {
                "internal": {"type": "integer", "minimum": 1, "maximum": 65535},
                "external": {"type": "integer", "minimum": 1, "maximum": 65535},
                "protocol": {"type": "string", "enum": ["tcp", "udp"]}
              }
            }
          },
          "config": {
            "type": "object",
            "properties": {
              "config_files": {
                "type": "array",
                "items": {
                  "type": "object",
                  "required": ["path", "content"],
                  "properties": {
                    "path": {"type": "string"},
                    "content": {"type": "string"}
                  }
                }
              },
              "credentials": {
                "type": "array",
                "items": {
                  "type": "object",
                  "required": ["username", "password"],
                  "properties": {
                    "username": {"type": "string"},
                    "password": {"type": "string"},
                    "role": {"type": "string"}
                  }
                }
              },
              "custom_setup": {"type": "string"}
            }
          }
        }
      }
    },
    "vulnerabilities": {
      "type": "array",
      "items": {
        "type": "object",
        "required": ["id", "name", "type", "severity", "description", "setup"],
        "properties": {
          "id": {"type": "string", "pattern": "^[a-z][a-z0-9_]*$"},
          "name": {"type": "string"},
          "type": {
            "type": "string",
            "enum": [
              "weak_password",
              "outdated_software",
              "misconfiguration",
              "default_creds",
              "exposed_service",
              "vulnerable_webapp",
              "directory_traversal",
              "sql_injection",
              "command_injection",
              "ssrf",
              "lateral_movement"
            ]
          },
          "severity": {"type": "string", "enum": ["low", "medium", "high", "critical"]},
          "description": {"type": "string"},
          "cve": {"type": "string"},
          "affected_service": {"type": "string"},
          "exploitation_notes": {"type": "string"},
          "remediation": {"type": "string"},
          "setup": {
            "type": "object",
            "required": ["module"],
            "properties": {
              "module": {"type": "string"},
              "parameters": {"type": "object"}
            }
          }
        }
      }
    },
    "flags": {
      "type": "array",
      "minItems": 1,
      "items": {
        "type": "object",
        "required": ["id", "name", "value", "placement", "points"],
        "properties": {
          "id": {"type": "string", "pattern": "^[a-z][a-z0-9_]*$"},
          "name": {"type": "string"},
          "value": {"type": "string"},
          "placement": {
            "type": "object",
            "required": ["type", "host_id", "details"],
            "properties": {
              "type": {"type": "string", "enum": ["file", "env", "service_response", "db_row"]},
              "host_id": {"type": "string"},
              "details": {"type": "object"}
            }
          },
          "points": {"type": "integer", "minimum": 1},
          "hint": {"type": "string"}
        }
      }
    },
    "scoring": {
      "type": "object",
      "properties": {
        "total_points": {"type": "integer", "minimum": 1},
        "passing_score": {"type": "integer", "minimum": 0},
        "time_bonus": {"type": "boolean"},
        "penalty_for_hints": {"type": "boolean"}
      }
    },
    "narrative": {
      "type": "object",
      "properties": {
        "scenario_background": {"type": "string"},
        "attacker_role": {"type": "string"},
        "objectives": {"type": "array", "items": {"type": "string"}},
        "success_criteria": {"type": "string"}
      }
    }
  }
}
